{
  "scenarioId": "merchant-beauty",
  "version": "1.0.0",
  "slug": "merchant-beauty",
  "codePrefix": "MJ-BEAUTY",
  "title": "وثيقة اختبار تجربة تاجر - سيناريو متجر عطور ومستحضرات تجميل مطابق لنظام Kaleem Stores",
  "description": "**اسم الوثيقة:** اختبار رحلة تاجر عطور ومستحضرات تجميل على Kaleem Stores\n**نوع الاختبار:** اختبار رحلة كاملة End-to-End\n**السيناريو:** متجر عطور، بخور، عناية، ومستحضرات تجميل\n**القالب المستهدف:** Beauty Luxe أو أقرب قالب Beauty/General متاح\n**الإصدار:** 3.1 - نسخة مطابقة للنظام الحالي مع تحسينات شاملة\n**آخر تحديث:** 2026-05-17\n**الغرض:** تسليم هذه الوثيقة لمختبر ينفذ تجربة واقعية كتاجر ثم كعميل نهائي، مع اختبار ما يدعمه النظام فعليًا حاليًا: تسجيل OTP، أونبوردنج التاجر، إعداد المتجر، دليل الجاهزية، القوالب، المنتجات والمتغيرات، الدفع اليدوي حسب إعدادات المنصة، التوصيل/الشحن/الاستلام، checkout، تتبع الطلب المختصر، إدارة الطلبات، الإشعارات، والأسئلة والمراجعات عند توفرها.\n---\n## متطلبات قبل بدء الاختبار\n- [ ] لدي بريد إلكتروني جديد أو قابل للاستخدام للاختبار.\n- [ ] لدي رقم/اسم مختبر لاستخدامه في slug.\n- [ ] لدي صور منتجات وشعار وبانر مناسبة لمتجر عطور وتجميل.\n- [ ] أعرف رابط لوحة التاجر.\n- [ ] أعرف رابط المتجر بعد إنشائه.\n- [ ] بيئة الاختبار واضحة: staging أو production أو local.\n- [ ] لا أستخدم بيانات تاجر حقيقي.\n- [ ] سأوثق كل مشكلة بصورة أو فيديو قصير إن أمكن.\n---\n> **تنبيه مهم جدًا حول البريد الإلكتروني:**\n>\n> يجب استخدام **بريد إلكتروني حقيقي وفعّال** أثناء التسجيل، لأن النظام سيرسل **كود تحقق OTP من 6 أرقام** إلى البريد المسجل ولا يمكن إكمال التسجيل بدونه.\n>\n> إذا لم يصل كود OTP إلى صندوق الوارد خلال دقائق، يجب:\n> - مراجعة مجلد **الرسائل غير المرغوب فيها (Spam / Junk)**.\n> - مراجعة جميع الرسائل والمجلدات الأخرى في البريد.\n> - استخدام زر **إعادة إرسال الكود** الذي يظهر في صفحة التحقق.\n>\n> عدم استخدام بريد حقيقي سيمنع إكمال الاختبار بالكامل.\n---\n## 1. معلومات المختبر\n| الحقل | الإجابة |\n|---|---|\n| اسم المختبر |  |\n| تاريخ الاختبار |  |\n| وقت البداية |  |\n| وقت النهاية |  |\n| الجهاز المستخدم | كمبيوتر / لابتوب / جوال / تابلت |\n| نظام التشغيل | Windows / macOS / Android / iOS |\n| المتصفح | Chrome / Edge / Safari / Firefox |\n| هل استخدمت Kaleem Stores من قبل؟ | نعم / لا |\n| هل لديك خبرة سابقة في إدارة متجر إلكتروني؟ | نعم / لا |\n| هل لديك معرفة ببيع العطور أو مستحضرات التجميل؟ | نعم / لا |\n| مستوى الخبرة التقنية | ضعيف / متوسط / جيد / ممتاز |\n---\n## 2. وصف الشخصية التي يمثلها المختبر\nأنت تمثل تاجرًا أو تاجرة تملك متجرًا صغيرًا في اليمن متخصصًا في:\n- العطور الرجالية.\n- العطور النسائية.\n- البخور والعود.\n- الزيوت العطرية.\n- منتجات العناية الشخصية.\n- مستحضرات تجميل بسيطة مثل المرطبات، كريمات البشرة، وأحمر الشفاه.\n- منتجات بخصومات.\n- منتجات مميزة.\n- منتجات نفدت من المخزون.\n- منتجات بمتغيرات مثل الحجم، الرائحة، الدرجة، أو نوع البشرة.\nاختبر النظام كما لو أنك تاجر حقيقي غير تقني ولا تعرف النظام مسبقًا. لا تفترض مكان أي زر أو إعداد. إذا توقفت أو لم تفهم خطوة، سجل ذلك فورًا.\n---\n## 3. هدف الاختبار\nنريد التأكد من أن Kaleem Stores مناسب لمتجر عطور وتجميل حقيقي ضمن قدرات النظام الحالية، وليس فقط مناسبًا لمنتجات عامة.\nالأهداف الأساسية:\n1. إنشاء حساب تاجر والتحقق من البريد عبر OTP.\n2. إكمال مرحلة أونبوردنج التاجر بعد OTP.\n3. فهم أن النظام ينشئ متجرًا تلقائيًا ثم يطلب إكمال بيانات أساسية.\n4. مراجعة دليل الجاهزية Store Readiness بعد الدخول للوحة.\n5. ضبط الهوية البصرية، الرابط، العنوان، الخريطة، ساعات العمل، وروابط التواصل.\n6. إنشاء أو مراجعة صفحات الثقة والسياسات.\n7. اختيار قالب مناسب للجمال والعطور ونشره.\n8. إنشاء التصنيفات والعلامات التجارية والسمات المناسبة للعطور والتجميل.\n9. إضافة منتجات واقعية تشمل البخور، العطور، العناية، والمكياج.\n10. اختبار المتغيرات مثل الحجم والرائحة والدرجة ونوع البشرة.\n11. إعداد طرق الدفع اليدوية الموجودة فعليًا حسب إعدادات المنصة.\n12. اختبار رفع إيصال الدفع، مع الانتباه أن الإيصال قد يكون اختياريًا أو إجباريًا حسب إعداد طريقة الدفع من المنصة.\n13. إعداد التوصيل/الشحن/الاستلام.\n14. تنفيذ رحلة عميل كاملة: تصفح، بحث، فلترة، سلة، checkout، طلب، وتتبع.\n15. اختبار المفضلة والمراجعات والأسئلة فقط عند تسجيل عميل، لأنها تحتاج تسجيل دخول.\n16. مراجعة الطلب والدفع والإشعارات من لوحة التاجر.\n17. تغيير حالة الطلب حسب الانتقالات المسموحة.\n18. تسجيل المشاكل ونقاط التحسين قبل تسليم النتيجة للفريق.\n---\n## 4. قواعد الاختبار\n1. لا تطلب مساعدة إلا إذا توقفت بالكامل.\n2. سجل أي رسالة خطأ نصًا أو بصورة شاشة.\n3. لا تعتبر المرحلة ناجحة إلا",
  "language": "ar",
  "direction": "rtl",
  "status": "draft",
  "estimatedDurationMinutes": 180,
  "sourceFile": "perfume_cosmetics_store_testing_scenario_kaleem_matched_v2_ready.md",
  "tags": [
    "merchant-journey",
    "e2e",
    "ux",
    "manual-qa",
    "beauty"
  ],
  "preconditions": [
    {
      "checkId": "MJ-BEAUTY-PRE-CHK-001",
      "order": 1,
      "text": "[ ] لدي بريد إلكتروني جديد أو قابل للاستخدام للاختبار.",
      "type": "status",
      "required": true,
      "weight": 1,
      "expectedResult": null,
      "allowAttachment": true,
      "allowIssue": true
    },
    {
      "checkId": "MJ-BEAUTY-PRE-CHK-002",
      "order": 2,
      "text": "[ ] لدي رقم/اسم مختبر لاستخدامه في slug.",
      "type": "status",
      "required": true,
      "weight": 1,
      "expectedResult": null,
      "allowAttachment": true,
      "allowIssue": true
    },
    {
      "checkId": "MJ-BEAUTY-PRE-CHK-003",
      "order": 3,
      "text": "[ ] لدي صور منتجات وشعار وبانر مناسبة لمتجر عطور وتجميل.",
      "type": "status",
      "required": true,
      "weight": 1,
      "expectedResult": null,
      "allowAttachment": true,
      "allowIssue": true
    },
    {
      "checkId": "MJ-BEAUTY-PRE-CHK-004",
      "order": 4,
      "text": "[ ] أعرف رابط لوحة التاجر.",
      "type": "status",
      "required": true,
      "weight": 1,
      "expectedResult": null,
      "allowAttachment": true,
      "allowIssue": true
    },
    {
      "checkId": "MJ-BEAUTY-PRE-CHK-005",
      "order": 5,
      "text": "[ ] أعرف رابط المتجر بعد إنشائه.",
      "type": "status",
      "required": true,
      "weight": 1,
      "expectedResult": null,
      "allowAttachment": true,
      "allowIssue": true
    },
    {
      "checkId": "MJ-BEAUTY-PRE-CHK-006",
      "order": 6,
      "text": "[ ] بيئة الاختبار واضحة: staging أو production أو local.",
      "type": "status",
      "required": true,
      "weight": 1,
      "expectedResult": null,
      "allowAttachment": true,
      "allowIssue": true
    },
    {
      "checkId": "MJ-BEAUTY-PRE-CHK-007",
      "order": 7,
      "text": "[ ] لا أستخدم بيانات تاجر حقيقي.",
      "type": "status",
      "required": true,
      "weight": 1,
      "expectedResult": null,
      "allowAttachment": true,
      "allowIssue": true
    },
    {
      "checkId": "MJ-BEAUTY-PRE-CHK-008",
      "order": 8,
      "text": "[ ] سأوثق كل مشكلة بصورة أو فيديو قصير إن أمكن.",
      "type": "status",
      "required": true,
      "weight": 1,
      "expectedResult": null,
      "allowAttachment": true,
      "allowIssue": true
    }
  ],
  "testData": [
    "| الحقل | القيمة المقترحة |",
    "|---|---|",
    "| اسم المتجر بالعربي | روز عود |",
    "| اسم المتجر بالإنجليزي | Rose Oud |",
    "| رابط المتجر المقترح | `rose-oud-[اسم المختبر]-0517` |",
    "| نوع النشاط | beauty |",
    "| الدولة | اليمن |",
    "| المحافظة | أمانة العاصمة أو صنعاء |",
    "| العنوان التفصيلي | شارع حدة، بجانب مركز تجميل تجريبي |",
    "| رقم التواصل | +9677xxxxxxx |",
    "| البريد | **استخدم بريدك الحقيقي** (سيصل كود OTP) |",
    "| العملة الافتراضية | YER |",
    "| المنطقة الزمنية | Asia/Aden |",
    "| القالب المفضل | Beauty Luxe أو أقرب قالب متاح |",
    "> ملاحظة اختبار مهمة: نوع النشاط `beauty` مدعوم في النظام الحالي، وقالب `Beauty Luxe` موجود ضمن القوالب الاحترافية إذا كانت بذور القوالب مفعلة في البيئة.",
    "> **ملاحظة مهمة حول الرابط:** لا تستخدم slug موجود مسبقًا. إذا ظهر أن الرابط مستخدم، أضف رقمًا أو اسمك في النهاية. الصيغة الصحيحة: `rose-oud-[اسم المختبر]-0517`",
    "روابط تواصل تجريبية:",
    "| المنصة | القيمة |",
    "|---|---|",
    "| WhatsApp | https://wa.me/9677xxxxxxx |",
    "| Instagram | https://instagram.com/roseoudyemen |",
    "| Facebook | https://facebook.com/roseoudyemen |",
    "| TikTok | https://tiktok.com/@roseoudyemen |",
    "| Snapchat | https://snapchat.com/add/roseoudyemen |",
    "| Telegram | https://t.me/roseoudyemen |",
    "| YouTube | https://youtube.com/@roseoudyemen |",
    "| Website | https://example.com |",
    "---"
  ],
  "phases": [
    {
      "phaseId": "MJ-BEAUTY-PH-001",
      "order": 1,
      "title": "إنشاء حساب التاجر والتحقق عبر OTP",
      "sourceTitle": "المرحلة الأولى: إنشاء حساب التاجر والتحقق عبر OTP",
      "objective": null,
      "instructions": [
        {
          "instructionId": "MJ-BEAUTY-PH-001-INST-001",
          "order": 1,
          "text": "افتح رابط لوحة تحكم التاجر."
        },
        {
          "instructionId": "MJ-BEAUTY-PH-001-INST-002",
          "order": 2,
          "text": "اختر إنشاء حساب تاجر."
        },
        {
          "instructionId": "MJ-BEAUTY-PH-001-INST-003",
          "order": 3,
          "text": "أدخل البيانات:"
        },
        {
          "instructionId": "MJ-BEAUTY-PH-001-INST-004",
          "order": 4,
          "text": "| الحقل | القيمة |"
        },
        {
          "instructionId": "MJ-BEAUTY-PH-001-INST-005",
          "order": 5,
          "text": "| الاسم الكامل | سارة روز |"
        },
        {
          "instructionId": "MJ-BEAUTY-PH-001-INST-006",
          "order": 6,
          "text": "| البريد الإلكتروني | **بريدك الحقيقي** (سيصل كود OTP) |"
        },
        {
          "instructionId": "MJ-BEAUTY-PH-001-INST-007",
          "order": 7,
          "text": "| رقم هاتف المالك | +9677xxxxxxx |"
        },
        {
          "instructionId": "MJ-BEAUTY-PH-001-INST-008",
          "order": 8,
          "text": "| كلمة المرور | 8 أحرف أو أكثر |"
        },
        {
          "instructionId": "MJ-BEAUTY-PH-001-INST-009",
          "order": 9,
          "text": "اضغط إرسال رمز التحقق."
        },
        {